{
    "version":  1,
    "effectCategories":  [
                             {
                                 "name":  "Reputation",
                                 "standard":  "ISO 31000",
                                 "matrixType":  "5X5",
                                 "consequenceLevels":  [
                                                           {
                                                               "level":  1,
                                                               "label":  "Negligible",
                                                               "descriptor":  "Slight media attention. Litle stakeholder impact"
                                                           },
                                                           {
                                                               "level":  2,
                                                               "label":  "Minor",
                                                               "descriptor":  "Local media attention. Minor stakeholder impact"
                                                           },
                                                           {
                                                               "level":  3,
                                                               "label":  "Moderate",
                                                               "descriptor":  "Regional media covrage. Moderate stakeholder impact"
                                                           },
                                                           {
                                                               "level":  4,
                                                               "label":  "Significant",
                                                               "descriptor":  "National media. Substantial stakeholder impact"
                                                           },
                                                           {
                                                               "level":  5,
                                                               "label":  "Severe",
                                                               "descriptor":  "International media coverage. Irreparable stakeholder impact"
                                                           }
                                                       ],
                                 "probabilityLevels":  [
                                                           {
                                                               "level":  1,
                                                               "label":  "Very low probability",
                                                               "descriptor":  "Probability of occurrence cannot be distinguished from zero"
                                                           },
                                                           {
                                                               "level":  2,
                                                               "label":  "Low probability",
                                                               "descriptor":  "Not Likely, but Possible"
                                                           },
                                                           {
                                                               "level":  3,
                                                               "label":  "Probable",
                                                               "descriptor":  "Likely to occur sometime"
                                                           },
                                                           {
                                                               "level":  4,
                                                               "label":  "High probability",
                                                               "descriptor":  "Likely to occur several times"
                                                           },
                                                           {
                                                               "level":  5,
                                                               "label":  "Very high probability",
                                                               "descriptor":  "Likely to occur repeatedly during activity"
                                                           }
                                                       ]
                             },
                             {
                                 "name":  "Finance",
                                 "standard":  "ISO 31000",
                                 "matrixType":  "5X5",
                                 "consequenceLevels":  [
                                                           {
                                                               "level":  1,
                                                               "label":  "Negligible",
                                                               "descriptor":  "\u003c 15.000 NOK"
                                                           },
                                                           {
                                                               "level":  2,
                                                               "label":  "Minor",
                                                               "descriptor":  "15\u0027 – 250\u0027 NOK"
                                                           },
                                                           {
                                                               "level":  3,
                                                               "label":  "Moderate",
                                                               "descriptor":  "250\u0027 – 1.000\u0027 NOK"
                                                           },
                                                           {
                                                               "level":  4,
                                                               "label":  "Significant",
                                                               "descriptor":  "1.000\u0027 – 5.000\u0027 NOK"
                                                           },
                                                           {
                                                               "level":  5,
                                                               "label":  "Severe",
                                                               "descriptor":  "\u003e 5 mill. NOK"
                                                           }
                                                       ],
                                 "probabilityLevels":  [
                                                           {
                                                               "level":  1,
                                                               "label":  "Very low probability",
                                                               "descriptor":  "Probability of occurrence cannot be distinguished from zero"
                                                           },
                                                           {
                                                               "level":  2,
                                                               "label":  "Low probability",
                                                               "descriptor":  "Not Likely, but Possible"
                                                           },
                                                           {
                                                               "level":  3,
                                                               "label":  "Probable",
                                                               "descriptor":  "Likely to occur sometime"
                                                           },
                                                           {
                                                               "level":  4,
                                                               "label":  "High probability",
                                                               "descriptor":  "Likely to occur several times"
                                                           },
                                                           {
                                                               "level":  5,
                                                               "label":  "Very high probability",
                                                               "descriptor":  "Likely to occur repeatedly during activity"
                                                           }
                                                       ]
                             },
                             {
                                 "name":  "Health",
                                 "standard":  "ISO 45001",
                                 "matrixType":  "5X5",
                                 "consequenceLevels":  [
                                                           {
                                                               "level":  1,
                                                               "label":  "Not Dangerous or hazardous",
                                                               "descriptor":  "Insignificant personnel injury with no absencefrom work"
                                                           },
                                                           {
                                                               "level":  2,
                                                               "label":  "Dangerous or hazardous",